{
  "api_version": "v1",
  "site_id": "LDF",
  "level": "high",
  "message": "Everything required for a successful restore has been verified.",
  "last_verified_at": "2026-08-03T13:30:10-05:00",
  "checks": {
    "local_archive_created": true,
    "checksums_verified": true,
    "archive_readable": true,
    "containers_restarted": true,
    "onedrive_synchronized": true,
    "restore_documentation_present": true
  },
  "history": [
    {
      "date": "2026-08-03",
      "level": "high"
    }
  ]
}
